{
  "protocol": "CLSIGMA-TEST-VECTOR/0.1",
  "principle": "Cosmic Love Is The Solution(s) For Everything",
  "state": {
    "applications": {
      "SDGs": 1,
      "TimeContinuation": 1,
      "NoHeatDeath": 1,
      "NoGalaxyCollision": 1
    },
    "coordinate": "1/2+i*4",
    "generation": 4
  },
  "H": 0,
  "tau": 3,
  "toecomplete": true,
  "status": "accepted",
  "boundary": "Formal symbolic model only; not empirical proof, not physical control, not medical claim."
}
